{
  "name": "host_operations",
  "revision": 1,
  "base_level": 1,
  "requires": [
    {"name": "namespaces", "revision": 1}
  ],
  "conflicts": [],
  "members": [
    {"kind": "behaviour", "name": "answer_operation"},
    {"kind": "behaviour", "name": "request:host.showPluginSettings"},
    {"kind": "behaviour", "name": "request:selection.replace"},
    {"kind": "behaviour", "name": "request:clipboard.write"},
    {"kind": "behaviour", "name": "request:clipboardHistory.show"},
    {"kind": "behaviour", "name": "request:open.url"},
    {"kind": "behaviour", "name": "request:open.path"},
    {"kind": "behaviour", "name": "request:open.application"},
    {"kind": "behaviour", "name": "request:apps.perform"},
    {"kind": "behaviour", "name": "request:apps.openDeepLink"},
    {"kind": "view_event", "name": "operation_finished"},
    {"kind": "behaviour", "name": "shows_insertion_target"},
    {"kind": "behaviour", "name": "execution_time_insertion_target"},
    {"kind": "behaviour", "name": "insertion_target_changed_failure"}
  ],
  "tag": "plugin-api-candidate/host_operations/r1",
  "status": "supported"
}
